[
  {
    "number": "ST01-001",
    "name": "蒙奇·D·路飞",
    "color": "红",
    "type": "领航",
    "property": "打",
    "power": "5000",
    "cost": "5",
    "keyWords": "超新星/草帽一伙",
    "counter": "",
    "effectTags": [
      "ActivatedMain"
    ],
    "abilities": [],
    "effectEvent": "",
    "rarity": "L",
    "subscript": 1,
    "trigger": "",
    "set": "基本卡组 草帽一伙【STC-01】",
    "image": "https://source.windoent.com/OnePiecePc/Picture/1669722375061ST01-001.png",
    "cartograph": "漫画"
  },
  {
    "number": "ST01-002",
    "name": "撒谎布",
    "color": "红",
    "type": "角色",
    "property": "射",
    "power": "2000",
    "cost": "2",
    "keyWords": "草帽一伙",
    "counter": "1000",
    "effectTags": [
      "OnAttackDeclare"
    ],
    "abilities": [],
    "effectEvent": "",
    "rarity": "C",
    "subscript": 1,
    "trigger": "【触发】此卡牌登场。",
    "set": "基本卡组 草帽一伙【STC-01】",
    "image": "https://source.windoent.com/OnePiecePc/Picture/1669722375063ST01-002.png",
    "cartograph": "动画"
  },
  {
    "number": "ST01-003",
    "name": "卡鲁",
    "color": "红",
    "type": "角色",
    "property": "打",
    "power": "3000",
    "cost": "1",
    "keyWords": "动物/阿拉巴斯坦王国",
    "counter": "1000",
    "effectTags": [],
    "abilities": [],
    "effectEvent": "",
    "rarity": "C",
    "subscript": 1,
    "trigger": "",
    "set": "基本卡组 草帽一伙【STC-01】",
    "image": "https://source.windoent.com/OnePiecePc/Picture/1669722375064ST01-003.png",
    "cartograph": "动画"
  },
  {
    "number": "ST01-004",
    "name": "山智",
    "color": "红",
    "type": "角色",
    "property": "打",
    "power": "4000",
    "cost": "2",
    "keyWords": "草帽一伙",
    "counter": "",
    "effectTags": [
      "OnEnterField"
    ],
    "abilities": [],
    "effectEvent": "",
    "rarity": "C",
    "subscript": 1,
    "trigger": "",
    "set": "基本卡组 草帽一伙【STC-01】",
    "image": "https://source.windoent.com/OnePiecePc/Picture/1669722375066ST01-004.png",
    "cartograph": "动画"
  },
  {
    "number": "ST01-005",
    "name": "甚平",
    "color": "红",
    "type": "角色",
    "property": "打",
    "power": "5000",
    "cost": "3",
    "keyWords": "鱼人族/草帽一伙",
    "counter": "",
    "effectTags": [
      "OnAttackDeclare"
    ],
    "abilities": [],
    "effectEvent": "",
    "rarity": "C",
    "subscript": 1,
    "trigger": "",
    "set": "基本卡组 草帽一伙【STC-01】",
    "image": "https://source.windoent.com/OnePiecePc/Picture/1669722375066ST01-005.png",
    "cartograph": "动画"
  },
  {
    "number": "ST01-006",
    "name": "托尼托尼·乔巴",
    "color": "红",
    "type": "角色",
    "property": "打",
    "power": "1000",
    "cost": "1",
    "keyWords": "动物/草帽一伙",
    "counter": "",
    "effectTags": [],
    "abilities": [
      "阻挡者"
    ],
    "effectEvent": "",
    "rarity": "C",
    "subscript": 1,
    "trigger": "",
    "set": "豪华补充包 历代典藏合集【PRBC-01】",
    "image": "https://source.windoent.com/OnePiecePc/Picture/1726626190566ST01-006_05.png",
    "cartograph": "画师原创"
  },
  {
    "number": "ST01-007",
    "name": "奈美",
    "color": "红",
    "type": "角色",
    "property": "特",
    "power": "1000",
    "cost": "1",
    "keyWords": "草帽一伙",
    "counter": "1000",
    "effectTags": [
      "ActivatedMain"
    ],
    "abilities": [],
    "effectEvent": "",
    "rarity": "C",
    "subscript": 1,
    "trigger": "",
    "set": "基本卡组 草帽一伙【STC-01】",
    "image": "https://source.windoent.com/OnePiecePc/Picture/1669722375066ST01-007.png",
    "cartograph": "动画"
  },
  {
    "number": "ST01-008",
    "name": "妮古·罗宾",
    "color": "红",
    "type": "角色",
    "property": "知",
    "power": "5000",
    "cost": "3",
    "keyWords": "草帽一伙",
    "counter": "1000",
    "effectTags": [],
    "abilities": [],
    "effectEvent": "",
    "rarity": "C",
    "subscript": 1,
    "trigger": "",
    "set": "基本卡组 草帽一伙【STC-01】",
    "image": "https://source.windoent.com/OnePiecePc/Picture/1669722375067ST01-008.png",
    "cartograph": "动画"
  },
  {
    "number": "ST01-009",
    "name": "奈菲特·薇薇",
    "color": "红",
    "type": "角色",
    "property": "斩",
    "power": "4000",
    "cost": "2",
    "keyWords": "阿拉巴斯坦王国",
    "counter": "1000",
    "effectTags": [],
    "abilities": [],
    "effectEvent": "",
    "rarity": "C",
    "subscript": 1,
    "trigger": "",
    "set": "基本卡组 草帽一伙【STC-01】",
    "image": "https://source.windoent.com/OnePiecePc/Picture/1669722375067ST01-009.png",
    "cartograph": "漫画"
  },
  {
    "number": "ST01-010",
    "name": "弗兰奇",
    "color": "红",
    "type": "角色",
    "property": "打",
    "power": "6000",
    "cost": "4",
    "keyWords": "草帽一伙",
    "counter": "1000",
    "effectTags": [],
    "abilities": [],
    "effectEvent": "",
    "rarity": "C",
    "subscript": 1,
    "trigger": "",
    "set": "基本卡组 草帽一伙【STC-01】",
    "image": "https://source.windoent.com/OnePiecePc/Picture/1669722375068ST01-010.png",
    "cartograph": "动画"
  },
  {
    "number": "ST01-011",
    "name": "布鲁克",
    "color": "红",
    "type": "角色",
    "property": "斩",
    "power": "3000",
    "cost": "2",
    "keyWords": "草帽一伙",
    "counter": "2000",
    "effectTags": [
      "OnEnterField"
    ],
    "abilities": [],
    "effectEvent": "",
    "rarity": "C",
    "subscript": 1,
    "trigger": "",
    "set": "豪华补充包 历代典藏合集Vol.2【PRBC-02】",
    "image": "https://source.windoent.com/OnePiecePc/Picture/1755138895737ST01-011_03.png",
    "cartograph": "动画"
  },
  {
    "number": "ST01-012",
    "name": "蒙奇·D·路飞",
    "color": "红",
    "type": "角色",
    "property": "打",
    "power": "6000",
    "cost": "5",
    "keyWords": "超新星/草帽一伙",
    "counter": "",
    "effectTags": [
      "OnAttackDeclare"
    ],
    "abilities": [
      "速攻"
    ],
    "effectEvent": "",
    "rarity": "SR",
    "subscript": 1,
    "trigger": "",
    "set": "补充包 新纪元的主角【OPC-05】",
    "image": "https://source.windoent.com/OnePiecePc/Picture/1697799658855ST01-012P-SR.png",
    "cartograph": "漫画"
  },
  {
    "number": "ST01-013",
    "name": "罗罗诺亚·佐罗",
    "color": "红",
    "type": "角色",
    "property": "斩",
    "power": "5000",
    "cost": "3",
    "keyWords": "超新星/草帽一伙",
    "counter": "",
    "effectTags": [
      "OnEnterField"
    ],
    "abilities": [],
    "effectEvent": "",
    "rarity": "SR",
    "subscript": 1,
    "trigger": "",
    "set": "基本卡组 草帽一伙【STC-01】",
    "image": "https://source.windoent.com/OnePiecePc/Picture/1669722375069ST01-013.png",
    "cartograph": "漫画"
  },
  {
    "number": "ST01-014",
    "name": "毛皮強化",
    "color": "红",
    "type": "事件",
    "property": "-",
    "power": "-",
    "cost": "1",
    "keyWords": "动物/草帽一伙",
    "counter": "",
    "effectTags": [
      "EventCounter"
    ],
    "abilities": [],
    "effectEvent": "",
    "rarity": "C",
    "subscript": 1,
    "trigger": "【触发】本回合中，我方最多1张领袖或角色力量+1000。",
    "set": "豪华补充包 历代典藏合集【PRBC-01】",
    "image": "https://source.windoent.com/OnePiecePc/Picture/1726626190567ST01-014_05.png",
    "cartograph": "漫画"
  },
  {
    "number": "ST01-015",
    "name": "橡皮橡皮JET枪",
    "color": "红",
    "type": "事件",
    "property": "-",
    "power": "-",
    "cost": "4",
    "keyWords": "超新星/草帽一伙",
    "counter": "",
    "effectTags": [
      "EventMain"
    ],
    "abilities": [],
    "effectEvent": "",
    "rarity": "C",
    "subscript": 1,
    "trigger": "【触发】发动此卡牌的【主要】效果。",
    "set": "基本卡组 草帽一伙【STC-01】",
    "image": "https://source.windoent.com/OnePiecePc/Picture/1669722375070ST01-015.png",
    "cartograph": "漫画"
  },
  {
    "number": "ST01-016",
    "name": "恶魔风脚",
    "color": "红",
    "type": "事件",
    "property": "-",
    "power": "-",
    "cost": "1",
    "keyWords": "草帽一伙",
    "counter": "",
    "effectTags": [
      "EventMain"
    ],
    "abilities": [],
    "effectEvent": "",
    "rarity": "C",
    "subscript": 1,
    "trigger": "【触发】将对方最多1张费用不高于3且拥有【阻挡者】效果的角色KO。",
    "set": "基本卡组 草帽一伙【STC-01】",
    "image": "https://source.windoent.com/OnePiecePc/Picture/1669722375071ST01-016.png",
    "cartograph": "漫画"
  },
  {
    "number": "ST01-017",
    "name": "千里・阳光号",
    "color": "红",
    "type": "舞台",
    "property": "-",
    "power": "-",
    "cost": "2",
    "keyWords": "草帽一伙",
    "counter": "",
    "effectTags": [
      "ActivatedMain"
    ],
    "abilities": [],
    "effectEvent": "",
    "rarity": "C",
    "subscript": 1,
    "trigger": "",
    "set": "基本卡组 草帽一伙【STC-01】",
    "image": "https://source.windoent.com/OnePiecePc/Picture/1669722375071ST01-017.png",
    "cartograph": "画师原创"
  }
]