[
  {
    "number": "ST08-001",
    "name": "蒙奇·D·路飞",
    "color": "黑",
    "type": "领航",
    "property": "打",
    "power": "5000",
    "cost": "5",
    "keyWords": "草帽一伙",
    "counter": "",
    "effectTags": [
      "OnKO"
    ],
    "abilities": [],
    "effectEvent": "",
    "rarity": "L",
    "subscript": 1,
    "trigger": "",
    "set": "基本卡组 第五个海上皇帝【STC-08】",
    "image": "https://source.windoent.com/OnePiecePc/Picture/1691139631934ST08-001.png",
    "cartograph": "画师原创"
  },
  {
    "number": "ST08-002",
    "name": "乌塔",
    "color": "黑",
    "type": "角色",
    "property": "特",
    "power": "3000",
    "cost": "2",
    "keyWords": "FILM",
    "counter": "",
    "effectTags": [
      "PreKO",
      "ActivatedMain",
      "OnEnterField"
    ],
    "abilities": [],
    "effectEvent": "",
    "rarity": "SR",
    "subscript": 1,
    "trigger": "",
    "set": "基本卡组 第五个海上皇帝【STC-08】",
    "image": "https://source.windoent.com/OnePiecePc/Picture/1691139631938ST08-002.png",
    "cartograph": "画师原创"
  },
  {
    "number": "ST08-003",
    "name": "盖蒙",
    "color": "黑",
    "type": "角色",
    "property": "知",
    "power": "4000",
    "cost": "2",
    "keyWords": "东海",
    "counter": "1000",
    "effectTags": [],
    "abilities": [],
    "effectEvent": "",
    "rarity": "C",
    "subscript": 1,
    "trigger": "",
    "set": "基本卡组 第五个海上皇帝【STC-08】",
    "image": "https://source.windoent.com/OnePiecePc/Picture/1691139631940ST08-003.png",
    "cartograph": "画师原创"
  },
  {
    "number": "ST08-004",
    "name": "可比",
    "color": "黑",
    "type": "角色",
    "property": "打",
    "power": "1000",
    "cost": "4",
    "keyWords": "海军",
    "counter": "1000",
    "effectTags": [
      "ActivatedMain"
    ],
    "abilities": [],
    "effectEvent": "",
    "rarity": "C",
    "subscript": 1,
    "trigger": "",
    "set": "基本卡组 第五个海上皇帝【STC-08】",
    "image": "https://source.windoent.com/OnePiecePc/Picture/1691139631941ST08-004.png",
    "cartograph": "画师原创"
  },
  {
    "number": "ST08-005",
    "name": "杰克斯",
    "color": "黑",
    "type": "角色",
    "property": "斩",
    "power": "10000",
    "cost": "9",
    "keyWords": "红发海盗团",
    "counter": "",
    "effectTags": [
      "OnEnterField"
    ],
    "abilities": [],
    "effectEvent": "",
    "rarity": "SR",
    "subscript": 1,
    "trigger": "",
    "set": "基本卡组 第五个海上皇帝【STC-08】",
    "image": "https://source.windoent.com/OnePiecePc/Picture/1691139631942ST08-005.png",
    "cartograph": "画师原创"
  },
  {
    "number": "ST08-006",
    "name": "白星",
    "color": "黑",
    "type": "角色",
    "property": "知",
    "power": "0",
    "cost": "4",
    "keyWords": "人鱼族",
    "counter": "1000",
    "effectTags": [
      "OnEnterField"
    ],
    "abilities": [
      "阻挡者"
    ],
    "effectEvent": "",
    "rarity": "C",
    "subscript": 1,
    "trigger": "",
    "set": "基本卡组 第五个海上皇帝【STC-08】",
    "image": "https://source.windoent.com/OnePiecePc/Picture/1691139631942ST08-006.png",
    "cartograph": "画师原创"
  },
  {
    "number": "ST08-007",
    "name": "奈菲特·薇薇",
    "color": "黑",
    "type": "角色",
    "property": "斩",
    "power": "1000",
    "cost": "3",
    "keyWords": "阿拉巴斯坦王国",
    "counter": "1000",
    "effectTags": [],
    "abilities": [
      "阻挡者"
    ],
    "effectEvent": "",
    "rarity": "C",
    "subscript": 1,
    "trigger": "【触发】此卡牌登场。",
    "set": "基本卡组 第五个海上皇帝【STC-08】",
    "image": "https://source.windoent.com/OnePiecePc/Picture/1691139631942ST08-007.png",
    "cartograph": "画师原创"
  },
  {
    "number": "ST08-008",
    "name": "日熊",
    "color": "黑",
    "type": "角色",
    "property": "斩",
    "power": "2000",
    "cost": "1",
    "keyWords": "山贼",
    "counter": "1000",
    "effectTags": [
      "OnEnterField"
    ],
    "abilities": [],
    "effectEvent": "",
    "rarity": "C",
    "subscript": 1,
    "trigger": "",
    "set": "基本卡组 第五个海上皇帝【STC-08】",
    "image": "https://source.windoent.com/OnePiecePc/Picture/1691139631942ST08-008.png",
    "cartograph": "画师原创"
  },
  {
    "number": "ST08-009",
    "name": "卷乃",
    "color": "黑",
    "type": "角色",
    "property": "知",
    "power": "0",
    "cost": "2",
    "keyWords": "风车村",
    "counter": "2000",
    "effectTags": [
      "OnEnterField"
    ],
    "abilities": [],
    "effectEvent": "",
    "rarity": "C",
    "subscript": 1,
    "trigger": "",
    "set": "基本卡组 第五个海上皇帝【STC-08】",
    "image": "https://source.windoent.com/OnePiecePc/Picture/1691139631943ST08-009.png",
    "cartograph": "画师原创"
  },
  {
    "number": "ST08-010",
    "name": "蒙奇·D·戈普",
    "color": "黑",
    "type": "角色",
    "property": "打",
    "power": "7000",
    "cost": "5",
    "keyWords": "海军",
    "counter": "1000",
    "effectTags": [],
    "abilities": [],
    "effectEvent": "",
    "rarity": "C",
    "subscript": 1,
    "trigger": "",
    "set": "基本卡组 第五个海上皇帝【STC-08】",
    "image": "https://source.windoent.com/OnePiecePc/Picture/1691139631943ST08-010.png",
    "cartograph": "画师原创"
  },
  {
    "number": "ST08-011",
    "name": "蒙奇·D·路飞",
    "color": "黑",
    "type": "角色",
    "property": "打",
    "power": "5000",
    "cost": "3",
    "keyWords": "草帽一伙",
    "counter": "1000",
    "effectTags": [],
    "abilities": [],
    "effectEvent": "",
    "rarity": "C",
    "subscript": 1,
    "trigger": "",
    "set": "基本卡组 第五个海上皇帝【STC-08】",
    "image": "https://source.windoent.com/OnePiecePc/Picture/1691139631943ST08-011.png",
    "cartograph": "画师原创"
  },
  {
    "number": "ST08-012",
    "name": "拉布",
    "color": "黑",
    "type": "角色",
    "property": "打",
    "power": "6000",
    "cost": "4",
    "keyWords": "动物",
    "counter": "1000",
    "effectTags": [],
    "abilities": [],
    "effectEvent": "",
    "rarity": "C",
    "subscript": 1,
    "trigger": "",
    "set": "基本卡组 第五个海上皇帝【STC-08】",
    "image": "https://source.windoent.com/OnePiecePc/Picture/1691139631943ST08-012.png",
    "cartograph": "画师原创"
  },
  {
    "number": "ST08-013",
    "name": "Mr.2·盆·岁末（本萨姆）",
    "color": "黑",
    "type": "角色",
    "property": "打",
    "power": "6000",
    "cost": "5",
    "keyWords": "原巴洛克工作室",
    "counter": "",
    "effectTags": [
      "OnBattleEnd"
    ],
    "abilities": [],
    "effectEvent": "",
    "rarity": "C",
    "subscript": 1,
    "trigger": "",
    "set": "基本卡组 第五个海上皇帝【STC-08】",
    "image": "https://source.windoent.com/OnePiecePc/Picture/1691139631944ST08-013.png",
    "cartograph": "画师原创"
  },
  {
    "number": "ST08-014",
    "name": "橡皮橡皮钟",
    "color": "黑",
    "type": "事件",
    "property": "-",
    "power": "-",
    "cost": "2",
    "keyWords": "草帽一伙",
    "counter": "",
    "effectTags": [
      "EventMain"
    ],
    "abilities": [],
    "effectEvent": "",
    "rarity": "C",
    "subscript": 1,
    "trigger": "【触发】将我方废弃区中最多1张费用不高于2的黑色角色卡牌加入手牌。",
    "set": "基本卡组 第五个海上皇帝【STC-08】",
    "image": "https://source.windoent.com/OnePiecePc/Picture/1691139631944ST08-014.png",
    "cartograph": "漫画"
  },
  {
    "number": "ST08-015",
    "name": "橡皮橡皮枪",
    "color": "黑",
    "type": "事件",
    "property": "-",
    "power": "-",
    "cost": "3",
    "keyWords": "草帽一伙",
    "counter": "",
    "effectTags": [
      "EventMain"
    ],
    "abilities": [],
    "effectEvent": "",
    "rarity": "C",
    "subscript": 1,
    "trigger": "【触发】抽取1张卡牌。",
    "set": "基本卡组 第五个海上皇帝【STC-08】",
    "image": "https://source.windoent.com/OnePiecePc/Picture/1691139631944ST08-015.png",
    "cartograph": "漫画"
  }
]