[
  {
    "number": "ST14-001",
    "name": "蒙奇·D·路飞",
    "color": "黑",
    "type": "领航",
    "property": "打",
    "power": "5000",
    "cost": "5",
    "keyWords": "草帽一伙",
    "counter": "",
    "effectTags": [],
    "abilities": [],
    "effectEvent": "",
    "rarity": "L",
    "subscript": 2,
    "trigger": "",
    "set": "基本卡组 两年后再出发【STC-14】",
    "image": "https://source.windoent.com/OnePiecePc/Picture/1718956827390ST14-001.png",
    "cartograph": "画师原创"
  },
  {
    "number": "ST14-002",
    "name": "撒谎布",
    "color": "黑",
    "type": "角色",
    "property": "射",
    "power": "4000",
    "cost": "3",
    "keyWords": "草帽一伙",
    "counter": "1000",
    "effectTags": [
      "OnAttackDeclare"
    ],
    "abilities": [],
    "effectEvent": "",
    "rarity": "C",
    "subscript": 2,
    "trigger": "",
    "set": "基本卡组 两年后再出发【STC-14】",
    "image": "https://source.windoent.com/OnePiecePc/Picture/1718956859285ST14-002.png",
    "cartograph": "画师原创"
  },
  {
    "number": "ST14-003",
    "name": "山智",
    "color": "黑",
    "type": "角色",
    "property": "打",
    "power": "6000",
    "cost": "5",
    "keyWords": "草帽一伙",
    "counter": "",
    "effectTags": [
      "OnEnterField"
    ],
    "abilities": [],
    "effectEvent": "",
    "rarity": "SR",
    "subscript": 2,
    "trigger": "",
    "set": "补充包 王之血脉【OPC-10】",
    "image": "https://source.windoent.com/OnePiecePc/Picture/1735798276559ST14-003_01.png",
    "cartograph": "画师原创"
  },
  {
    "number": "ST14-004",
    "name": "甚平",
    "color": "黑",
    "type": "角色",
    "property": "打",
    "power": "4000",
    "cost": "3",
    "keyWords": "鱼人族/太阳海盗团",
    "counter": "1000",
    "effectTags": [
      "ActivatedMain"
    ],
    "abilities": [],
    "effectEvent": "",
    "rarity": "C",
    "subscript": 2,
    "trigger": "",
    "set": "基本卡组 两年后再出发【STC-14】",
    "image": "https://source.windoent.com/OnePiecePc/Picture/1718956827397ST14-004.png",
    "cartograph": "画师原创"
  },
  {
    "number": "ST14-005",
    "name": "托尼托尼·乔巴",
    "color": "黑",
    "type": "角色",
    "property": "知",
    "power": "6000",
    "cost": "4",
    "keyWords": "动物/草帽一伙",
    "counter": "1000",
    "effectTags": [],
    "abilities": [],
    "effectEvent": "",
    "rarity": "C",
    "subscript": 2,
    "trigger": "",
    "set": "基本卡组 两年后再出发【STC-14】",
    "image": "https://source.windoent.com/OnePiecePc/Picture/1718956827398ST14-005.png",
    "cartograph": "画师原创"
  },
  {
    "number": "ST14-006",
    "name": "奈美",
    "color": "黑",
    "type": "角色",
    "property": "特",
    "power": "2000",
    "cost": "3",
    "keyWords": "草帽一伙",
    "counter": "1000",
    "effectTags": [
      "OnEnterField"
    ],
    "abilities": [
      "阻挡者"
    ],
    "effectEvent": "",
    "rarity": "SR",
    "subscript": 2,
    "trigger": "",
    "set": "基本卡组 两年后再出发【STC-14】",
    "image": "https://source.windoent.com/OnePiecePc/Picture/1718956827398ST14-006.png",
    "cartograph": "画师原创"
  },
  {
    "number": "ST14-007",
    "name": "妮古·罗宾",
    "color": "黑",
    "type": "角色",
    "property": "打",
    "power": "7000",
    "cost": "6",
    "keyWords": "草帽一伙",
    "counter": "1000",
    "effectTags": [
      "OnEnterField",
      "OnAttackDeclare"
    ],
    "abilities": [],
    "effectEvent": "",
    "rarity": "C",
    "subscript": 2,
    "trigger": "",
    "set": "豪华补充包 历代典藏合集Vol.2【PRBC-02】",
    "image": "https://source.windoent.com/OnePiecePc/Picture/1755138895760ST14-007_01.png",
    "cartograph": "画师原创"
  },
  {
    "number": "ST14-008",
    "name": "哈雷达斯",
    "color": "黑",
    "type": "角色",
    "property": "知",
    "power": "0",
    "cost": "1",
    "keyWords": "空岛",
    "counter": "2000",
    "effectTags": [
      "ActivatedMain"
    ],
    "abilities": [],
    "effectEvent": "",
    "rarity": "C",
    "subscript": 2,
    "trigger": "",
    "set": "基本卡组 两年后再出发【STC-14】",
    "image": "https://source.windoent.com/OnePiecePc/Picture/1718956827399ST14-008.png",
    "cartograph": "画师原创"
  },
  {
    "number": "ST14-009",
    "name": "弗兰奇",
    "color": "黑",
    "type": "角色",
    "property": "特",
    "power": "6000",
    "cost": "5",
    "keyWords": "草帽一伙",
    "counter": "1000",
    "effectTags": [
      "OnEnterField"
    ],
    "abilities": [],
    "effectEvent": "",
    "rarity": "C",
    "subscript": 2,
    "trigger": "",
    "set": "基本卡组 两年后再出发【STC-14】",
    "image": "https://source.windoent.com/OnePiecePc/Picture/1718956827399ST14-009.png",
    "cartograph": "画师原创"
  },
  {
    "number": "ST14-010",
    "name": "布鲁克",
    "color": "黑",
    "type": "角色",
    "property": "斩",
    "power": "7000",
    "cost": "5",
    "keyWords": "草帽一伙",
    "counter": "1000",
    "effectTags": [],
    "abilities": [],
    "effectEvent": "",
    "rarity": "C",
    "subscript": 2,
    "trigger": "",
    "set": "豪华补充包 历代典藏合集Vol.2【PRBC-02】",
    "image": "https://source.windoent.com/OnePiecePc/Picture/1755138895762ST14-010_01.png",
    "cartograph": "画师原创"
  },
  {
    "number": "ST14-011",
    "name": "海格力斯",
    "color": "黑",
    "type": "角色",
    "property": "知",
    "power": "2000",
    "cost": "1",
    "keyWords": "波音列岛",
    "counter": "2000",
    "effectTags": [
      "ActivatedMain"
    ],
    "abilities": [],
    "effectEvent": "",
    "rarity": "C",
    "subscript": 2,
    "trigger": "",
    "set": "基本卡组 两年后再出发【STC-14】",
    "image": "https://source.windoent.com/OnePiecePc/Picture/1718956827400ST14-011.png",
    "cartograph": "画师原创"
  },
  {
    "number": "ST14-012",
    "name": "蒙奇·D·路飞",
    "color": "黑",
    "type": "角色",
    "property": "打",
    "power": "10000",
    "cost": "8",
    "keyWords": "草帽一伙",
    "counter": "",
    "effectTags": [
      "OnEnterField"
    ],
    "abilities": [
      "速攻"
    ],
    "effectEvent": "",
    "rarity": "C",
    "subscript": 2,
    "trigger": "",
    "set": "基本卡组 两年后再出发【STC-14】",
    "image": "https://source.windoent.com/OnePiecePc/Picture/1718956827401ST14-012.png",
    "cartograph": "画师原创"
  },
  {
    "number": "ST14-013",
    "name": "罗罗诺亚·佐罗",
    "color": "黑",
    "type": "角色",
    "property": "斩",
    "power": "8000",
    "cost": "6",
    "keyWords": "草帽一伙",
    "counter": "1000",
    "effectTags": [],
    "abilities": [],
    "effectEvent": "",
    "rarity": "C",
    "subscript": 2,
    "trigger": "",
    "set": "豪华补充包 历代典藏合集Vol.2【PRBC-02】",
    "image": "https://source.windoent.com/OnePiecePc/Picture/1755138895766ST14-013_01.png",
    "cartograph": "画师原创"
  },
  {
    "number": "ST14-014",
    "name": "橡皮橡皮巨人回转弹",
    "color": "黑",
    "type": "事件",
    "property": "-",
    "power": "-",
    "cost": "1",
    "keyWords": "草帽一伙",
    "counter": "",
    "effectTags": [
      "EventCounter"
    ],
    "abilities": [],
    "effectEvent": "",
    "rarity": "C",
    "subscript": 2,
    "trigger": "【触发】将我方废弃区中最多1张费用不高于2的角色卡牌加入手牌。",
    "set": "基本卡组 两年后再出发【STC-14】",
    "image": "https://source.windoent.com/OnePiecePc/Picture/1718956827402ST14-014.png",
    "cartograph": "画师原创"
  },
  {
    "number": "ST14-015",
    "name": "橡皮橡皮恶魔风三刀流羊肉JET六百烦恼攻城炮",
    "color": "黑",
    "type": "事件",
    "property": "-",
    "power": "-",
    "cost": "2",
    "keyWords": "草帽一伙",
    "counter": "",
    "effectTags": [
      "EventMain"
    ],
    "abilities": [],
    "effectEvent": "",
    "rarity": "C",
    "subscript": 2,
    "trigger": "【触发】我方场上存在费用为8或更高的角色的场合，将对方最多1张费用不高于5的角色KO。",
    "set": "基本卡组 两年后再出发【STC-14】",
    "image": "https://source.windoent.com/OnePiecePc/Picture/1718956827403ST14-015.png",
    "cartograph": "画师原创"
  },
  {
    "number": "ST14-016",
    "name": "我还有伙伴们!!!",
    "color": "黑",
    "type": "事件",
    "property": "-",
    "power": "-",
    "cost": "1",
    "keyWords": "草帽一伙",
    "counter": "",
    "effectTags": [
      "EventMain"
    ],
    "abilities": [],
    "effectEvent": "",
    "rarity": "C",
    "subscript": 2,
    "trigger": "",
    "set": "豪华补充包 历代典藏合集Vol.2【PRBC-02】",
    "image": "https://source.windoent.com/OnePiecePc/Picture/1755138895768ST14-016_01.png",
    "cartograph": "漫画"
  },
  {
    "number": "ST14-017",
    "name": "千里·阳光号",
    "color": "黑",
    "type": "舞台",
    "property": "-",
    "power": "-",
    "cost": "1",
    "keyWords": "草帽一伙",
    "counter": "",
    "effectTags": [
      "OnEnterField"
    ],
    "abilities": [],
    "effectEvent": "",
    "rarity": "C",
    "subscript": 2,
    "trigger": "",
    "set": "豪华补充包 历代典藏合集Vol.2【PRBC-02】",
    "image": "https://source.windoent.com/OnePiecePc/Picture/1755138895770ST14-017_01.png",
    "cartograph": "漫画"
  }
]