[
  {
    "number": "ST20-001",
    "name": "夏洛特·卡塔库栗",
    "color": "黄",
    "type": "角色",
    "property": "打",
    "power": "6000",
    "cost": "5",
    "keyWords": "大妈海盗团",
    "counter": "1000",
    "effectTags": [
      "ActivatedMain"
    ],
    "abilities": [
      "阻挡者"
    ],
    "effectEvent": "",
    "rarity": "SR",
    "subscript": 3,
    "trigger": "",
    "set": "豪华训练套装",
    "image": "https://source.windoent.com/OnePiecePc/Picture/1732685887435ST20-001.png",
    "cartograph": "画师原创"
  },
  {
    "number": "ST20-002",
    "name": "夏洛特·克力架",
    "color": "黄",
    "type": "角色",
    "property": "斩",
    "power": "5000",
    "cost": "4",
    "keyWords": "大妈海盗团",
    "counter": "1000",
    "effectTags": [
      "PreKO",
      "OnAllyWillBeKOd"
    ],
    "abilities": [],
    "effectEvent": "",
    "rarity": "C",
    "subscript": 3,
    "trigger": "【触发】可以丢弃我方的1张手牌：此卡牌登场。",
    "set": "豪华训练套装",
    "image": "https://source.windoent.com/OnePiecePc/Picture/1732685887436ST20-002.png",
    "cartograph": "画师原创"
  },
  {
    "number": "ST20-003",
    "name": "夏洛特·布蕾",
    "color": "黄",
    "type": "角色",
    "property": "特",
    "power": "3000",
    "cost": "3",
    "keyWords": "大妈海盗团",
    "counter": "2000",
    "effectTags": [],
    "abilities": [],
    "effectEvent": "",
    "rarity": "C",
    "subscript": 3,
    "trigger": "【触发】确认我方或对方生命区最上方的最多1张卡牌，将其放置到生命区最上方或最下方。之后，将此卡牌加入手牌。",
    "set": "豪华补充包 历代典藏合集Vol.2【PRBC-02】",
    "image": "https://source.windoent.com/OnePiecePc/Picture/1755138895793ST20-003_01.png",
    "cartograph": "画师原创"
  }
]