[
  {
    "number": "PRB01-001",
    "name": "山智",
    "color": "红",
    "type": "领航",
    "property": "打",
    "power": "5000",
    "cost": "5",
    "keyWords": "草帽一伙",
    "counter": "",
    "effectTags": [
      "OnEnterField",
      "ActivatedMain"
    ],
    "abilities": [],
    "effectEvent": "",
    "rarity": "L",
    "subscript": 3,
    "trigger": "",
    "set": "豪华补充包 历代典藏合集【PRBC-01】",
    "image": "https://source.windoent.com/OnePiecePc/Picture/1726626190400EB02-001.png",
    "cartograph": "动画"
  }
]
