[
  {
    "number": "ST37-001",
    "name": "蒙奇·D·路飞",
    "color": "红/蓝",
    "type": "领航",
    "property": "打",
    "power": "5000",
    "cost": "3",
    "keyWords": "阿拉巴斯坦王国/草帽一伙",
    "counter": "",
    "effectTags": [
      "OnAttackDeclare"
    ],
    "abilities": [],
    "effectEvent": "",
    "rarity": "L",
    "subscript": 5,
    "trigger": "",
    "set": "起始卡组【ST-37】",
    "image": "/cards/st37/ST37-001.png",
    "cartograph": ""
  }
]
