[
  {
    "number": "ST07-001",
    "name": "夏洛特·玲玲",
    "color": "黄",
    "type": "领航",
    "property": "特",
    "power": "5000",
    "cost": "5",
    "keyWords": "四皇/大妈海盗团",
    "counter": "",
    "effectTags": [
      "OnAttackDeclare"
    ],
    "abilities": [],
    "effectEvent": "",
    "rarity": "L",
    "subscript": 1,
    "trigger": "",
    "set": "基本卡组 大妈海盗团【STC-07】",
    "image": "https://source.windoent.com/OnePiecePc/Picture/1682578157899ST07-001%282%29.png",
    "cartograph": "漫画"
  },
  {
    "number": "ST07-002",
    "name": "夏洛特·亚娜娜",
    "color": "黄",
    "type": "角色",
    "property": "知",
    "power": "3000",
    "cost": "-",
    "keyWords": "大妈海盗团",
    "counter": "1000",
    "effectTags": [],
    "abilities": [],
    "effectEvent": "",
    "rarity": "C",
    "subscript": 1,
    "trigger": "",
    "set": "基本卡组 大妈海盗团【STC-07】",
    "image": "https://source.windoent.com/OnePiecePc/Picture/1682042835794ST07-002.png",
    "cartograph": "画师原创"
  },
  {
    "number": "ST07-003",
    "name": "夏洛特·卡塔库栗",
    "color": "黄",
    "type": "角色",
    "property": "打",
    "power": "6000",
    "cost": "-",
    "keyWords": "大妈海盗团",
    "counter": "",
    "effectTags": [
      "OnEnterField"
    ],
    "abilities": [],
    "effectEvent": "",
    "rarity": "SR",
    "subscript": 1,
    "trigger": "",
    "set": "基本卡组 大妈海盗团【STC-07】",
    "image": "https://source.windoent.com/OnePiecePc/Picture/1682042835800ST07-003.png",
    "cartograph": "漫画"
  },
  {
    "number": "ST07-004",
    "name": "夏洛特·小食",
    "color": "黄",
    "type": "角色",
    "property": "斩",
    "power": "6000",
    "cost": "-",
    "keyWords": "大妈海盗团",
    "counter": "",
    "effectTags": [
      "OnAttackDeclare"
    ],
    "abilities": [],
    "effectEvent": "",
    "rarity": "C",
    "subscript": 1,
    "trigger": "",
    "set": "基本卡组 大妈海盗团【STC-07】",
    "image": "https://source.windoent.com/OnePiecePc/Picture/1682042835801ST07-004.png",
    "cartograph": "画师原创"
  },
  {
    "number": "ST07-005",
    "name": "夏洛特·大福",
    "color": "黄",
    "type": "角色",
    "property": "斩",
    "power": "5000",
    "cost": "-",
    "keyWords": "大妈海盗团",
    "counter": "1000",
    "effectTags": [
      "OnAttackDeclare"
    ],
    "abilities": [],
    "effectEvent": "",
    "rarity": "C",
    "subscript": 1,
    "trigger": "",
    "set": "基本卡组 大妈海盗团【STC-07】",
    "image": "https://source.windoent.com/OnePiecePc/Picture/1682042835803ST07-005.png",
    "cartograph": "画师原创"
  },
  {
    "number": "ST07-006",
    "name": "夏洛特·弗朗蓓",
    "color": "黄",
    "type": "角色",
    "property": "射",
    "power": "4000",
    "cost": "-",
    "keyWords": "大妈海盗团",
    "counter": "1000",
    "effectTags": [],
    "abilities": [],
    "effectEvent": "",
    "rarity": "C",
    "subscript": 1,
    "trigger": "",
    "set": "基本卡组 大妈海盗团【STC-07】",
    "image": "https://source.windoent.com/OnePiecePc/Picture/1682042835803ST07-006.png",
    "cartograph": "画师原创"
  },
  {
    "number": "ST07-007",
    "name": "夏洛特·布蕾",
    "color": "黄",
    "type": "角色",
    "property": "特",
    "power": "1000",
    "cost": "3",
    "keyWords": "大妈海盗团",
    "counter": "1000",
    "effectTags": [],
    "abilities": [
      "阻挡者"
    ],
    "effectEvent": "",
    "rarity": "C",
    "subscript": 1,
    "trigger": "【触发】此卡牌登场。",
    "set": "豪华补充包 历代典藏合集【PRBC-01】",
    "image": "https://source.windoent.com/OnePiecePc/Picture/1726626190583ST07-007_05.png",
    "cartograph": "动画"
  },
  {
    "number": "ST07-008",
    "name": "夏洛特·布玲",
    "color": "黄",
    "type": "角色",
    "property": "知",
    "power": "3000",
    "cost": "-",
    "keyWords": "大妈海盗团",
    "counter": "2000",
    "effectTags": [
      "OnEnterField"
    ],
    "abilities": [],
    "effectEvent": "",
    "rarity": "C",
    "subscript": 1,
    "trigger": "",
    "set": "基本卡组 大妈海盗团【STC-07】",
    "image": "https://source.windoent.com/OnePiecePc/Picture/1682042835804ST07-008.png",
    "cartograph": "动画"
  },
  {
    "number": "ST07-009",
    "name": "夏洛特·蒙道尔",
    "color": "黄",
    "type": "角色",
    "property": "特",
    "power": "4000",
    "cost": "-",
    "keyWords": "大妈海盗团",
    "counter": "1000",
    "effectTags": [
      "ActivatedMain"
    ],
    "abilities": [],
    "effectEvent": "",
    "rarity": "C",
    "subscript": 1,
    "trigger": "【触发】可以丢弃我方的1张手牌：此卡牌登场。",
    "set": "基本卡组 大妈海盗团【STC-07】",
    "image": "https://source.windoent.com/OnePiecePc/Picture/1682042835804ST07-009.png",
    "cartograph": "画师原创"
  },
  {
    "number": "ST07-010",
    "name": "夏洛特·玲玲",
    "color": "黄",
    "type": "角色",
    "property": "特",
    "power": "8000",
    "cost": "-",
    "keyWords": "四皇/大妈海盗团",
    "counter": "",
    "effectTags": [
      "OnEnterField"
    ],
    "abilities": [],
    "effectEvent": "",
    "rarity": "SR",
    "subscript": 1,
    "trigger": "",
    "set": "基本卡组 大妈海盗团【STC-07】",
    "image": "https://source.windoent.com/OnePiecePc/Picture/1682042835805ST07-010.png",
    "cartograph": "画师原创"
  },
  {
    "number": "ST07-011",
    "name": "宙斯",
    "color": "黄",
    "type": "角色",
    "property": "特",
    "power": "3000",
    "cost": "-",
    "keyWords": "大妈海盗团/Homies",
    "counter": "1000",
    "effectTags": [
      "ActivatedMain"
    ],
    "abilities": [],
    "effectEvent": "",
    "rarity": "C",
    "subscript": 1,
    "trigger": "【触发】此卡牌登场。",
    "set": "基本卡组 大妈海盗团【STC-07】",
    "image": "https://source.windoent.com/OnePiecePc/Picture/1682042835805ST07-011.png",
    "cartograph": "画师原创"
  },
  {
    "number": "ST07-012",
    "name": "蛋蛋男爵",
    "color": "黄",
    "type": "角色",
    "property": "打",
    "power": "6000",
    "cost": "-",
    "keyWords": "大妈海盗团",
    "counter": "1000",
    "effectTags": [],
    "abilities": [],
    "effectEvent": "",
    "rarity": "C",
    "subscript": 1,
    "trigger": "",
    "set": "基本卡组 大妈海盗团【STC-07】",
    "image": "https://source.windoent.com/OnePiecePc/Picture/1682042835805ST07-012.png",
    "cartograph": "动画"
  },
  {
    "number": "ST07-013",
    "name": "普罗米修斯",
    "color": "黄",
    "type": "角色",
    "property": "特",
    "power": "3000",
    "cost": "-",
    "keyWords": "大妈海盗团/Homies",
    "counter": "1000",
    "effectTags": [
      "ActivatedMain"
    ],
    "abilities": [],
    "effectEvent": "",
    "rarity": "C",
    "subscript": 1,
    "trigger": "【触发】此卡牌登场。",
    "set": "基本卡组 大妈海盗团【STC-07】",
    "image": "https://source.windoent.com/OnePiecePc/Picture/1682042835806ST07-013.png",
    "cartograph": "画师原创"
  },
  {
    "number": "ST07-014",
    "name": "扁姆兹",
    "color": "黄",
    "type": "角色",
    "property": "打",
    "power": "5000",
    "cost": "-",
    "keyWords": "纯毛族/大妈海盗团",
    "counter": "1000",
    "effectTags": [],
    "abilities": [],
    "effectEvent": "",
    "rarity": "C",
    "subscript": 1,
    "trigger": "",
    "set": "基本卡组 大妈海盗团【STC-07】",
    "image": "https://source.windoent.com/OnePiecePc/Picture/1682042835806ST07-014.png",
    "cartograph": "动画"
  },
  {
    "number": "ST07-015",
    "name": "对魂低语",
    "color": "黄",
    "type": "事件",
    "property": "-",
    "power": "-",
    "cost": "-",
    "keyWords": "四皇/大妈海盗团",
    "counter": "",
    "effectTags": [
      "EventMain"
    ],
    "abilities": [],
    "effectEvent": "",
    "rarity": "C",
    "subscript": 1,
    "trigger": "【触发】发动此卡牌的【主要】效果。",
    "set": "基本卡组 大妈海盗团【STC-07】",
    "image": "https://source.windoent.com/OnePiecePc/Picture/1682044395351ST07-016.png",
    "cartograph": "漫画"
  },
  {
    "number": "ST07-016",
    "name": "强力麻糬",
    "color": "黄",
    "type": "事件",
    "property": "-",
    "power": "-",
    "cost": "-",
    "keyWords": "大妈海盗团",
    "counter": "",
    "effectTags": [
      "EventCounter"
    ],
    "abilities": [],
    "effectEvent": "",
    "rarity": "C",
    "subscript": 1,
    "trigger": "【触发】抽取1张卡牌，确认我方或对方生命区最上方的最多1张卡牌，放置到生命区最上方或最下方。",
    "set": "基本卡组 大妈海盗团【STC-07】",
    "image": "https://source.windoent.com/OnePiecePc/Picture/1682044408639ST07-015.png",
    "cartograph": "漫画"
  },
  {
    "number": "ST07-017",
    "name": "女王妈妈圣歌号",
    "color": "黄",
    "type": "舞台",
    "property": "-",
    "power": "-",
    "cost": "-",
    "keyWords": "大妈海盗团/Homies",
    "counter": "",
    "effectTags": [
      "ActivatedMain"
    ],
    "abilities": [],
    "effectEvent": "",
    "rarity": "C",
    "subscript": 1,
    "trigger": "【触发】此卡牌登场。",
    "set": "基本卡组 大妈海盗团【STC-07】",
    "image": "https://source.windoent.com/OnePiecePc/Picture/1682042835811ST07-017.png",
    "cartograph": "漫画"
  }
]
