[
  {
    "number": "ST24-001",
    "name": "卡彭·班吉",
    "color": "绿",
    "type": "角色",
    "property": "射",
    "power": "1000",
    "cost": "2",
    "keyWords": "超新星/火焰坦克海盗团",
    "counter": "1000",
    "effectTags": [
      "OnEnterField"
    ],
    "abilities": [
      "阻挡者"
    ],
    "effectEvent": "",
    "rarity": "C",
    "subscript": 3,
    "trigger": "",
    "set": "对战进阶套组2025",
    "image": "https://source.windoent.com/OnePiecePc/Picture/1754038797255ST24-001.png",
    "cartograph": "画师原创"
  },
  {
    "number": "ST24-002",
    "name": "基德＆基拉",
    "color": "绿",
    "type": "角色",
    "property": "斩/特",
    "power": "2000",
    "cost": "2",
    "keyWords": "超新星/基德海盗团",
    "counter": "1000",
    "effectTags": [
      "OnEnterField",
      "OnOppAttackDeclare"
    ],
    "abilities": [],
    "effectEvent": "",
    "rarity": "SR",
    "subscript": 3,
    "trigger": "",
    "set": "对战进阶套组2025",
    "image": "https://source.windoent.com/OnePiecePc/Picture/1754038797256ST24-002.png",
    "cartograph": "画师原创"
  },
  {
    "number": "ST24-003",
    "name": "巴基尔·霍金斯",
    "color": "绿",
    "type": "角色",
    "property": "斩",
    "power": "4000",
    "cost": "4",
    "keyWords": "超新星/霍金斯海盗团",
    "counter": "2000",
    "effectTags": [
      "OnMyTurnEnd"
    ],
    "abilities": [],
    "effectEvent": "",
    "rarity": "C",
    "subscript": 3,
    "trigger": "",
    "set": "对战进阶套组2025",
    "image": "https://source.windoent.com/OnePiecePc/Picture/1754038797256ST24-003.png",
    "cartograph": "画师原创"
  },
  {
    "number": "ST24-004",
    "name": "罗&贝宝",
    "color": "绿",
    "type": "角色",
    "property": "斩/打",
    "power": "11000",
    "cost": "10",
    "keyWords": "纯毛族/超新星/心脏海盗团",
    "counter": "",
    "effectTags": [
      "OnEnterField"
    ],
    "abilities": [],
    "effectEvent": "",
    "rarity": "SR",
    "subscript": 3,
    "trigger": "",
    "set": "对战进阶套组2025",
    "image": "https://source.windoent.com/OnePiecePc/Picture/1754038797257ST24-004.png",
    "cartograph": "画师原创"
  },
  {
    "number": "ST24-005",
    "name": "X·德雷克",
    "color": "绿",
    "type": "角色",
    "property": "斩",
    "power": "5000",
    "cost": "5",
    "keyWords": "超新星/海军/德雷克海盗团",
    "counter": "2000",
    "effectTags": [
      "OnEnterField"
    ],
    "abilities": [],
    "effectEvent": "",
    "rarity": "C",
    "subscript": 3,
    "trigger": "",
    "set": "对战进阶套组2025",
    "image": "https://source.windoent.com/OnePiecePc/Picture/1754038797257ST24-005.png",
    "cartograph": "画师原创"
  }
]