[
  {
    "number": "ST03-001",
    "name": "克洛克达尔",
    "color": "蓝",
    "type": "领航",
    "property": "特",
    "power": "5000",
    "cost": "5",
    "keyWords": "王下七武海/巴洛克工作室",
    "counter": "",
    "effectTags": [
      "ActivatedMain"
    ],
    "abilities": [],
    "effectEvent": "",
    "rarity": "L",
    "subscript": 1,
    "trigger": "",
    "set": "基本卡组 王下七武海【STC-03】",
    "image": "https://source.windoent.com/OnePiecePc/Picture/1669722328424ST03-001.png",
    "cartograph": "漫画"
  },
  {
    "number": "ST03-002",
    "name": "爱德华·维布鲁",
    "color": "蓝",
    "type": "角色",
    "property": "斩",
    "power": "5000",
    "cost": "3",
    "keyWords": "王下七武海",
    "counter": "1000",
    "effectTags": [],
    "abilities": [],
    "effectEvent": "",
    "rarity": "C",
    "subscript": 1,
    "trigger": "",
    "set": "基本卡组 王下七武海【STC-03】",
    "image": "https://source.windoent.com/OnePiecePc/Picture/1669722328426ST03-002.png",
    "cartograph": "动画"
  },
  {
    "number": "ST03-003",
    "name": "克洛克达尔",
    "color": "蓝",
    "type": "角色",
    "property": "特",
    "power": "6000",
    "cost": "5",
    "keyWords": "王下七武海/巴洛克工作室",
    "counter": "",
    "effectTags": [
      "OnBlockDeclare"
    ],
    "abilities": [
      "阻挡者"
    ],
    "effectEvent": "",
    "rarity": "SR",
    "subscript": 1,
    "trigger": "",
    "set": "基本卡组 王下七武海【STC-03】",
    "image": "https://source.windoent.com/OnePiecePc/Picture/1669722328427ST03-003.png",
    "cartograph": "漫画"
  },
  {
    "number": "ST03-004",
    "name": "月光·莫利亚",
    "color": "蓝",
    "type": "角色",
    "property": "特",
    "power": "5000",
    "cost": "4",
    "keyWords": "王下七武海/恐怖之船海盗团",
    "counter": "1000",
    "effectTags": [
      "OnEnterField"
    ],
    "abilities": [],
    "effectEvent": "",
    "rarity": "C",
    "subscript": 1,
    "trigger": "",
    "set": "补充包 传说的强者【OPC-08】",
    "image": "https://source.windoent.com/OnePiecePc/Picture/1720666299300ST03-004_03.png",
    "cartograph": "画师原创"
  },
  {
    "number": "ST03-005",
    "name": "杰拉基尔·米霍克",
    "color": "蓝",
    "type": "角色",
    "property": "斩",
    "power": "5000",
    "cost": "4",
    "keyWords": "王下七武海",
    "counter": "2000",
    "effectTags": [
      "OnAttackDeclare"
    ],
    "abilities": [],
    "effectEvent": "",
    "rarity": "C",
    "subscript": 1,
    "trigger": "",
    "set": "豪华补充包 历代典藏合集【PRBC-01】",
    "image": "https://source.windoent.com/OnePiecePc/Picture/1726626190570ST03-005_05.png",
    "cartograph": "动画"
  },
  {
    "number": "ST03-006",
    "name": "甚平",
    "color": "蓝",
    "type": "角色",
    "property": "打",
    "power": "4000",
    "cost": "2",
    "keyWords": "鱼人族/王下七武海/太阳海盗团",
    "counter": "1000",
    "effectTags": [],
    "abilities": [],
    "effectEvent": "",
    "rarity": "C",
    "subscript": 1,
    "trigger": "",
    "set": "基本卡组 王下七武海【STC-03】",
    "image": "https://source.windoent.com/OnePiecePc/Picture/1669722328429ST03-006.png",
    "cartograph": "动画"
  },
  {
    "number": "ST03-007",
    "name": "战桃丸",
    "color": "蓝",
    "type": "角色",
    "property": "斩",
    "power": "4000",
    "cost": "3",
    "keyWords": "海军",
    "counter": "1000",
    "effectTags": [
      "ActivatedMain"
    ],
    "abilities": [],
    "effectEvent": "",
    "rarity": "C",
    "subscript": 1,
    "trigger": "",
    "set": "基本卡组 王下七武海【STC-03】",
    "image": "https://source.windoent.com/OnePiecePc/Picture/1669722328429ST03-007.png",
    "cartograph": "漫画"
  },
  {
    "number": "ST03-008",
    "name": "特拉法尔加·罗",
    "color": "蓝",
    "type": "角色",
    "property": "斩",
    "power": "1000",
    "cost": "1",
    "keyWords": "王下七武海/心脏海盗团",
    "counter": "",
    "effectTags": [],
    "abilities": [
      "阻挡者"
    ],
    "effectEvent": "",
    "rarity": "C",
    "subscript": 1,
    "trigger": "",
    "set": "豪华补充包 历代典藏合集【PRBC-01】",
    "image": "https://source.windoent.com/OnePiecePc/Picture/1726626190572ST03-008_05.png",
    "cartograph": "动画"
  },
  {
    "number": "ST03-009",
    "name": "堂吉诃德・多弗拉门戈",
    "color": "蓝",
    "type": "角色",
    "property": "特",
    "power": "7000",
    "cost": "7",
    "keyWords": "王下七武海/堂吉诃德海盗团",
    "counter": "",
    "effectTags": [
      "OnEnterField"
    ],
    "abilities": [],
    "effectEvent": "",
    "rarity": "SR",
    "subscript": 1,
    "trigger": "",
    "set": "补充包 强大的敌人【OPC-03】",
    "image": "https://source.windoent.com/OnePiecePc/Picture/1682589336160ST03-009SP.png",
    "cartograph": "动画"
  },
  {
    "number": "ST03-010",
    "name": "巴索罗缪·大熊",
    "color": "蓝",
    "type": "角色",
    "property": "打",
    "power": "3000",
    "cost": "2",
    "keyWords": "王下七武海/革命军",
    "counter": "",
    "effectTags": [
      "OnEnterField"
    ],
    "abilities": [],
    "effectEvent": "",
    "rarity": "C",
    "subscript": 1,
    "trigger": "【触发】此卡牌登场。",
    "set": "基本卡组 王下七武海【STC-03】",
    "image": "https://source.windoent.com/OnePiecePc/Picture/1669722328430ST03-010.png",
    "cartograph": "动画"
  },
  {
    "number": "ST03-011",
    "name": "巴奇",
    "color": "蓝",
    "type": "角色",
    "property": "斩",
    "power": "3000",
    "cost": "1",
    "keyWords": "王下七武海/巴奇速递",
    "counter": "1000",
    "effectTags": [],
    "abilities": [],
    "effectEvent": "",
    "rarity": "C",
    "subscript": 1,
    "trigger": "",
    "set": "基本卡组 王下七武海【STC-03】",
    "image": "https://source.windoent.com/OnePiecePc/Picture/1669722328430ST03-011.png",
    "cartograph": "动画"
  },
  {
    "number": "ST03-012",
    "name": "和平主义者",
    "color": "蓝",
    "type": "角色",
    "property": "特",
    "power": "6000",
    "cost": "4",
    "keyWords": "生物兵器/海军",
    "counter": "1000",
    "effectTags": [],
    "abilities": [],
    "effectEvent": "",
    "rarity": "C",
    "subscript": 1,
    "trigger": "",
    "set": "基本卡组 王下七武海【STC-03】",
    "image": "https://source.windoent.com/OnePiecePc/Picture/1669722328430ST03-012.png",
    "cartograph": "动画"
  },
  {
    "number": "ST03-013",
    "name": "波尔·汉库珂",
    "color": "蓝",
    "type": "角色",
    "property": "特",
    "power": "1000",
    "cost": "3",
    "keyWords": "王下七武海/九蛇海盗团",
    "counter": "1000",
    "effectTags": [],
    "abilities": [
      "阻挡者"
    ],
    "effectEvent": "",
    "rarity": "C",
    "subscript": 1,
    "trigger": "【触发】此卡牌登场。",
    "set": "豪华补充包 历代典藏合集【PRBC-01】",
    "image": "https://source.windoent.com/OnePiecePc/Picture/1733812833556ST03-013_05.png",
    "cartograph": "画师原创"
  },
  {
    "number": "ST03-014",
    "name": "马歇尔·D·提奇",
    "color": "蓝",
    "type": "角色",
    "property": "特",
    "power": "4000",
    "cost": "4",
    "keyWords": "王下七武海/黑胡子海盗团",
    "counter": "1000",
    "effectTags": [
      "OnEnterField"
    ],
    "abilities": [],
    "effectEvent": "",
    "rarity": "C",
    "subscript": 1,
    "trigger": "",
    "set": "基本卡组 王下七武海【STC-03】",
    "image": "https://source.windoent.com/OnePiecePc/Picture/1669722328431ST03-014.png",
    "cartograph": "动画"
  },
  {
    "number": "ST03-015",
    "name": "沙尘暴",
    "color": "蓝",
    "type": "事件",
    "property": "-",
    "power": "-",
    "cost": "4",
    "keyWords": "王下七武海/巴洛克工作室",
    "counter": "",
    "effectTags": [
      "EventMain"
    ],
    "abilities": [],
    "effectEvent": "",
    "rarity": "C",
    "subscript": 1,
    "trigger": "【触发】发动此卡牌的【主要】效果。",
    "set": "基本卡组 王下七武海【STC-03】",
    "image": "https://source.windoent.com/OnePiecePc/Picture/1669722328431ST03-015.png",
    "cartograph": "漫画"
  },
  {
    "number": "ST03-016",
    "name": "压力炮",
    "color": "蓝",
    "type": "事件",
    "property": "-",
    "power": "-",
    "cost": "2",
    "keyWords": "王下七武海/革命军",
    "counter": "",
    "effectTags": [
      "EventCounter"
    ],
    "abilities": [],
    "effectEvent": "",
    "rarity": "C",
    "subscript": 1,
    "trigger": "【触发】发动此卡牌的【反击】效果。",
    "set": "基本卡组 王下七武海【STC-03】",
    "image": "https://source.windoent.com/OnePiecePc/Picture/1669722328431ST03-016.png",
    "cartograph": "漫画"
  },
  {
    "number": "ST03-017",
    "name": "颓靡甜风",
    "color": "蓝",
    "type": "事件",
    "property": "-",
    "power": "-",
    "cost": "2",
    "keyWords": "王下七武海/九蛇海盗团",
    "counter": "",
    "effectTags": [
      "EventCounter"
    ],
    "abilities": [],
    "effectEvent": "",
    "rarity": "C",
    "subscript": 1,
    "trigger": "",
    "set": "基本卡组 王下七武海【STC-03】",
    "image": "https://source.windoent.com/OnePiecePc/Picture/1669722328432ST03-017.png",
    "cartograph": "漫画"
  }
]
