[
  {
    "number": "ST10-001",
    "name": "特拉法尔加·罗",
    "color": "红/紫",
    "type": "领航",
    "property": "斩",
    "power": "5000",
    "cost": "4",
    "keyWords": "心脏海盗团",
    "counter": "",
    "effectTags": [
      "ActivatedMain"
    ],
    "abilities": [],
    "effectEvent": "",
    "rarity": "L",
    "subscript": 2,
    "trigger": "",
    "set": "究极进阶卡组 “三方船长”集结【STC-10】",
    "image": "https://source.windoent.com/OnePiecePc/Picture/1698374966833ST10-001.png",
    "cartograph": "画师原创"
  },
  {
    "number": "ST10-002",
    "name": "蒙奇·D·路飞",
    "color": "红/紫",
    "type": "领航",
    "property": "打",
    "power": "6000",
    "cost": "3",
    "keyWords": "草帽一伙",
    "counter": "",
    "effectTags": [
      "ActivatedMain"
    ],
    "abilities": [],
    "effectEvent": "",
    "rarity": "L",
    "subscript": 2,
    "trigger": "",
    "set": "究极进阶卡组 “三方船长”集结【STC-10】",
    "image": "https://source.windoent.com/OnePiecePc/Picture/1698374966835ST10-002.png",
    "cartograph": "画师原创"
  },
  {
    "number": "ST10-003",
    "name": "尤斯塔斯·基德",
    "color": "红/紫",
    "type": "领航",
    "property": "特",
    "power": "5000",
    "cost": "5",
    "keyWords": "基德海盗团",
    "counter": "",
    "effectTags": [
      "OnAttackDeclare"
    ],
    "abilities": [],
    "effectEvent": "",
    "rarity": "L",
    "subscript": 2,
    "trigger": "",
    "set": "究极进阶卡组 “三方船长”集结【STC-10】",
    "image": "https://source.windoent.com/OnePiecePc/Picture/1698374966835ST10-003.png",
    "cartograph": "画师原创"
  },
  {
    "number": "ST10-004",
    "name": "山智",
    "color": "红",
    "type": "角色",
    "property": "打",
    "power": "6000",
    "cost": "6",
    "keyWords": "草帽一伙",
    "counter": "1000",
    "effectTags": [
      "OnEnterField"
    ],
    "abilities": [
      "速攻"
    ],
    "effectEvent": "",
    "rarity": "C",
    "subscript": 2,
    "trigger": "",
    "set": "究极进阶卡组 “三方船长”集结【STC-10】",
    "image": "https://source.windoent.com/OnePiecePc/Picture/1698374966835ST10-004.png",
    "cartograph": "画师原创"
  },
  {
    "number": "ST10-005",
    "name": "甚平",
    "color": "红",
    "type": "角色",
    "property": "打",
    "power": "2000",
    "cost": "2",
    "keyWords": "鱼人族/草帽一伙",
    "counter": "2000",
    "effectTags": [
      "OnAttackDeclare"
    ],
    "abilities": [],
    "effectEvent": "",
    "rarity": "C",
    "subscript": 2,
    "trigger": "",
    "set": "豪华补充包 历代典藏合集Vol.2【PRBC-02】",
    "image": "https://source.windoent.com/OnePiecePc/Picture/1755138895743ST10-005_01.png",
    "cartograph": "画师原创"
  },
  {
    "number": "ST10-006",
    "name": "蒙奇·D·路飞",
    "color": "红",
    "type": "角色",
    "property": "打",
    "power": "11000",
    "cost": "10",
    "keyWords": "草帽一伙",
    "counter": "",
    "effectTags": [
      "OnOppBlocker"
    ],
    "abilities": [
      "阻挡者",
      "速攻"
    ],
    "effectEvent": "",
    "rarity": "SR",
    "subscript": 2,
    "trigger": "",
    "set": "究极进阶卡组 “三方船长”集结【STC-10】",
    "image": "https://source.windoent.com/OnePiecePc/Picture/1698374966836ST10-006.png",
    "cartograph": "画师原创"
  },
  {
    "number": "ST10-007",
    "name": "基拉",
    "color": "紫",
    "type": "角色",
    "property": "斩",
    "power": "6000",
    "cost": "5",
    "keyWords": "基德海盗团",
    "counter": "1000",
    "effectTags": [
      "OnDonReturnedToDeck"
    ],
    "abilities": [],
    "effectEvent": "",
    "rarity": "C",
    "subscript": 2,
    "trigger": "",
    "set": "究极进阶卡组 “三方船长”集结【STC-10】",
    "image": "https://source.windoent.com/OnePiecePc/Picture/1698374966836ST10-007.png",
    "cartograph": "画师原创"
  },
  {
    "number": "ST10-008",
    "name": "夏齐＆佩金",
    "color": "紫",
    "type": "角色",
    "property": "射",
    "power": "5000",
    "cost": "4",
    "keyWords": "心脏海盗团",
    "counter": "2000",
    "effectTags": [
      "OnEnterField"
    ],
    "abilities": [],
    "effectEvent": "",
    "rarity": "C",
    "subscript": 2,
    "trigger": "",
    "set": "豪华补充包 历代典藏合集Vol.2【PRBC-02】",
    "image": "https://source.windoent.com/OnePiecePc/Picture/1755138895744ST10-008_01.png",
    "cartograph": "画师原创"
  },
  {
    "number": "ST10-009",
    "name": "江波尔",
    "color": "紫",
    "type": "角色",
    "property": "打",
    "power": "5000",
    "cost": "4",
    "keyWords": "心脏海盗团",
    "counter": "1000",
    "effectTags": [
      "OnEnterField"
    ],
    "abilities": [],
    "effectEvent": "",
    "rarity": "C",
    "subscript": 2,
    "trigger": "",
    "set": "究极进阶卡组 “三方船长”集结【STC-10】",
    "image": "https://source.windoent.com/OnePiecePc/Picture/1698374966837ST10-009.png",
    "cartograph": "画师原创"
  },
  {
    "number": "ST10-010",
    "name": "特拉法尔加·罗",
    "color": "紫",
    "type": "角色",
    "property": "斩",
    "power": "5000",
    "cost": "4",
    "keyWords": "心脏海盗团",
    "counter": "1000",
    "effectTags": [
      "OnEnterField"
    ],
    "abilities": [
      "阻挡者"
    ],
    "effectEvent": "",
    "rarity": "SR",
    "subscript": 2,
    "trigger": "",
    "set": "豪华补充包 历代典藏合集【PRBC-01】",
    "image": "https://source.windoent.com/OnePiecePc/Picture/1726626190586ST10-010_05.png",
    "cartograph": "画师原创"
  },
  {
    "number": "ST10-011",
    "name": "火特",
    "color": "紫",
    "type": "角色",
    "property": "特",
    "power": "4000",
    "cost": "3",
    "keyWords": "基德海盗团",
    "counter": "1000",
    "effectTags": [
      "OnDonReturnedToDeck"
    ],
    "abilities": [],
    "effectEvent": "",
    "rarity": "C",
    "subscript": 2,
    "trigger": "",
    "set": "究极进阶卡组 “三方船长”集结【STC-10】",
    "image": "https://source.windoent.com/OnePiecePc/Picture/1698374966838ST10-011.png",
    "cartograph": "画师原创"
  },
  {
    "number": "ST10-012",
    "name": "贝宝",
    "color": "紫",
    "type": "角色",
    "property": "打",
    "power": "5000",
    "cost": "4",
    "keyWords": "纯毛族/心脏海盗团",
    "counter": "1000",
    "effectTags": [
      "OnEnterField",
      "OnAttackDeclare"
    ],
    "abilities": [],
    "effectEvent": "",
    "rarity": "C",
    "subscript": 2,
    "trigger": "",
    "set": "究极进阶卡组 “三方船长”集结【STC-10】",
    "image": "https://source.windoent.com/OnePiecePc/Picture/1698374966838ST10-012.png",
    "cartograph": "画师原创"
  },
  {
    "number": "ST10-013",
    "name": "尤斯塔斯·基德",
    "color": "紫",
    "type": "角色",
    "property": "特",
    "power": "8000",
    "cost": "7",
    "keyWords": "基德海盗团",
    "counter": "",
    "effectTags": [
      "OnEnterField",
      "OnAttackDeclare"
    ],
    "abilities": [],
    "effectEvent": "",
    "rarity": "SR",
    "subscript": 2,
    "trigger": "",
    "set": "究极进阶卡组 “三方船长”集结【STC-10】",
    "image": "https://source.windoent.com/OnePiecePc/Picture/1698374966838ST10-013.png",
    "cartograph": "画师原创"
  },
  {
    "number": "ST10-014",
    "name": "瓦亚",
    "color": "紫",
    "type": "角色",
    "property": "斩",
    "power": "3000",
    "cost": "3",
    "keyWords": "基德海盗团",
    "counter": "1000",
    "effectTags": [
      "OnDonReturnedToDeck"
    ],
    "abilities": [
      "阻挡者"
    ],
    "effectEvent": "",
    "rarity": "C",
    "subscript": 2,
    "trigger": "",
    "set": "究极进阶卡组 “三方船长”集结【STC-10】",
    "image": "https://source.windoent.com/OnePiecePc/Picture/1698374966839ST10-014.png",
    "cartograph": "画师原创"
  },
  {
    "number": "ST10-015",
    "name": "橡皮橡皮巨人推掌",
    "color": "红",
    "type": "事件",
    "property": "-",
    "power": "-",
    "cost": "1",
    "keyWords": "草帽一伙",
    "counter": "",
    "effectTags": [],
    "abilities": [],
    "effectEvent": "",
    "rarity": "C",
    "subscript": 2,
    "trigger": "【反击】本次战斗中，我方最多1张领袖或角色力量+2000，并将对方最多1张力量不高于2000的角色KO。",
    "set": "究极进阶卡组 “三方船长”集结【STC-10】",
    "image": "https://source.windoent.com/OnePiecePc/Picture/1698374966839ST10-015.png",
    "cartograph": "漫画"
  },
  {
    "number": "ST10-016",
    "name": "橡皮橡皮猿王枪乱打",
    "color": "红",
    "type": "事件",
    "property": "-",
    "power": "-",
    "cost": "5",
    "keyWords": "草帽一伙",
    "counter": "",
    "effectTags": [
      "EventMain"
    ],
    "abilities": [],
    "effectEvent": "",
    "rarity": "C",
    "subscript": 2,
    "trigger": "",
    "set": "究极进阶卡组 “三方船长”集结【STC-10】",
    "image": "https://source.windoent.com/OnePiecePc/Picture/1698374966840ST10-016.png",
    "cartograph": "漫画"
  },
  {
    "number": "ST10-017",
    "name": "磁气虎钳",
    "color": "紫",
    "type": "事件",
    "property": "-",
    "power": "-",
    "cost": "3",
    "keyWords": "基德海盗团",
    "counter": "",
    "effectTags": [
      "EventMain"
    ],
    "abilities": [],
    "effectEvent": "",
    "rarity": "C",
    "subscript": 2,
    "trigger": "",
    "set": "究极进阶卡组 “三方船长”集结【STC-10】",
    "image": "https://source.windoent.com/OnePiecePc/Picture/1698374966841ST10-017.png",
    "cartograph": "漫画"
  }
]
