[
  {
    "number": "ST18-001",
    "name": "撒谎八",
    "color": "紫",
    "type": "角色",
    "property": "射",
    "power": "3000",
    "cost": "3",
    "keyWords": "草帽一伙",
    "counter": "2000",
    "effectTags": [
      "OnEnterField"
    ],
    "abilities": [],
    "effectEvent": "",
    "rarity": "C",
    "subscript": 3,
    "trigger": "",
    "set": "豪华补充包 历代典藏合集Vol.2【PRBC-02】",
    "image": "https://source.windoent.com/OnePiecePc/Picture/1755138895784ST18-001_02.png",
    "cartograph": "画师原创"
  },
  {
    "number": "ST18-002",
    "name": "阿奈美",
    "color": "紫",
    "type": "角色",
    "property": "特",
    "power": "2000",
    "cost": "4",
    "keyWords": "草帽一伙",
    "counter": "1000",
    "effectTags": [
      "OnEnterField"
    ],
    "abilities": [
      "阻挡者"
    ],
    "effectEvent": "",
    "rarity": "C",
    "subscript": 3,
    "trigger": "",
    "set": "豪华补充包 历代典藏合集Vol.2【PRBC-02】",
    "image": "https://source.windoent.com/OnePiecePc/Picture/1755138895787ST18-002_02.png",
    "cartograph": "画师原创"
  },
  {
    "number": "ST18-003",
    "name": "山五郎",
    "color": "紫",
    "type": "角色",
    "property": "打",
    "power": "6000",
    "cost": "5",
    "keyWords": "草帽一伙",
    "counter": "1000",
    "effectTags": [
      "OnAttackDeclare"
    ],
    "abilities": [],
    "effectEvent": "",
    "rarity": "C",
    "subscript": 3,
    "trigger": "",
    "set": "豪华补充包 历代典藏合集Vol.2【PRBC-02】",
    "image": "https://source.windoent.com/OnePiecePc/Picture/1755138895789ST18-003_01.png",
    "cartograph": "画师原创"
  },
  {
    "number": "ST18-004",
    "name": "卓洛十郎",
    "color": "紫",
    "type": "角色",
    "property": "斩",
    "power": "6000",
    "cost": "4",
    "keyWords": "草帽一伙",
    "counter": "",
    "effectTags": [
      "OnEnterField"
    ],
    "abilities": [],
    "effectEvent": "",
    "rarity": "SR",
    "subscript": 4,
    "trigger": "",
    "set": "豪华补充包 历代典藏合集Vol.2【PRBC-02】",
    "image": "",
    "cartograph": "画师原创"
  },
  {
    "number": "ST18-005",
    "name": "路飞太郎",
    "color": "紫",
    "type": "角色",
    "property": "打",
    "power": "8000",
    "cost": "7",
    "keyWords": "草帽一伙",
    "counter": "",
    "effectTags": [
      "OnEnterField"
    ],
    "abilities": [],
    "effectEvent": "",
    "rarity": "SR",
    "subscript": 3,
    "trigger": "",
    "set": "补充包 神速之拳【OPC-11】",
    "image": "https://source.windoent.com/OnePiecePc/Picture/1743991893675ST18-005_01.png",
    "cartograph": "画师原创"
  }
]
